"diplomacy_id","dynasty_id","partner_tr","partner_en","partner_type","relation_tr","relation_en","period","notes_tr","notes_en","narrative_tr","narrative_en","strategic_impact_tr","legacy_tr"
"1","1","Sâsânî İmparatorluğu","Sassanid Empire","İmparatorluk","Savaş/Fetih","War/Conquest","633-651","Kādisiye ve Nihâvend savaşları; İran'ın fethi","Battles of Qadisiyyah and Nihavand; conquest of Iran","Hz. Ömer döneminde başlayan Sâsânî İran'ın fethi, İslam tarihinin en belirleyici askeri kampanyasıdır. Kādisiye (636) ve Nihâvend (642) savaşları altı yüz yıllık Sâsânî İmparatorluğu'nu yıkarak Mezopotamya, İran ve Orta Asya'yı İslam dünyasına açtı. Bu fetih İslam medeniyetinin Arap çekirdeğinden kozmopolit bir imparatorluğa dönüşümünün başlangıcıdır.","The conquest of Sasanian Iran beginning under Caliph Umar was the most defining military campaign of Islamic history. The battles of Qadisiyyah (636) and Nihavand (642) destroyed the six-century Sasanian Empire, opening Mesopotamia, Iran and Central Asia to the Islamic world. This conquest marked the beginning of Islamic civilization's transformation from an Arab core to a cosmopolitan empire.","İran'ın zenginliği ve idari geleneği Müslüman devlet yapısını temelden dönüştürdü.","Fars kültürü İslam medeniyetinin ayrılmaz parçası haline geldi; divân sistemi ve vezirlik kurumu Sâsânî mirasıdır."
"2","1","Bizans İmparatorluğu","Byzantine Empire","İmparatorluk","Savaş/Fetih","War/Conquest","634-641","Suriye, Filistin, Mısır'ın fethi","Conquest of Syria, Palestine, Egypt","İslam'ın ilk on yılındaki Bizans fetihleri — Yarmûk (636) ile başlayıp Suriye, Filistin ve Mısır'ın alınmasıyla devam eden süreç — Akdeniz dünyasının siyasi haritasını kalıcı olarak değiştirdi. Bizans bu toprakları bir daha geri alamadı. Bu fetihler İslam'ı küçük bir Arap harekâtından dünya gücüne dönüştüren yapısal kırılma noktasıdır.","Islam's first decade of Byzantine conquests — beginning with Yarmouk (636) and continuing with the capture of Syria, Palestine and Egypt — permanently changed the Mediterranean's political map. Byzantium never recovered these territories. These conquests were the structural turning point transforming Islam from a small Arab movement to a world power.","Bizans'ın en zengin eyaletleri kaybetmesi imparatorluğu kalıcı olarak zayıflattı.","Kudüs İslam'ın üçüncü kutsal şehri, Mısır İslam dünyasının en zengin vilayeti oldu."
"3","2","Bizans İmparatorluğu","Byzantine Empire","İmparatorluk","Savaş/Diplomasi","War/Diplomacy","661-750","İstanbul kuşatmaları (674-678, 717-718); sınır savaşları","Sieges of Constantinople; border wars","Emevî-Bizans ilişkisi yedi yüzyıl sürecek İslam-Hristiyan cepheleşmesinin temelini oluşturdu. İstanbul kuşatmaları (674-678, 717-718) başarısız olsa da İslam'ın Avrupa'ya yayılma iradesini gösterdi. Sınır bölgesinde (sugûr/thughûr) oluşan tampon bölge askeri ve kültürel bir etkileşim alanı haline geldi.","The Umayyad-Byzantine relationship formed the foundation of an Islamic-Christian confrontation that would last seven centuries. Though the sieges of Constantinople failed, they demonstrated Islam's will to expand into Europe. The frontier zone (thughur) became an area of military and cultural interaction.","İstanbul kuşatmalarının başarısızlığı İslam'ın Avrupa'ya kara yoluyla yayılma stratejisini sınırladı.","Sugûr/thughûr sınır sistemi İslam askeri-idari geleneğinin önemli bir kurumu haline geldi."
"4","2","Tang Çin Hanedanı","Tang Dynasty China","İmparatorluk","Savaş/Ticaret","War/Trade","700-751","Talas Savaşı (751); İpek Yolu ticareti","Battle of Talas (751); Silk Road trade","Tang Çin'i ile Emevîler arasındaki ilişki 751 Talas Savaşı'yla zirveye ulaştı. Bu savaş İslam ile Çin arasındaki tek büyük askeri çatışmaydı ve kâğıt yapım teknolojisinin İslam dünyasına transferine yol açtı. Savaş sonrası İpek Yolu ticareti devam etti; çatışmadan çok ticari işbirliği ilişkilere damga vurdu.","The Umayyad-Tang China relationship peaked with the 751 Battle of Talas. This was the only major military clash between Islam and China, leading to the transfer of papermaking technology to the Islamic world. Post-battle, Silk Road trade continued; commercial cooperation rather than conflict defined relations.","Talas sonrası Orta Asya kalıcı olarak İslam etki alanına girdi.","Kâğıt teknolojisi transferi İslam entelektüel devriminin fiziksel altyapısını sağladı."
"5","3","Bizans İmparatorluğu","Byzantine Empire","İmparatorluk","Savaş/Diplomasi","War/Diplomacy","750-1055","Esir değişimi; sınır garnizonu sistemi (sugūr/thughūr)","Prisoner exchanges; frontier garrison system","Abbâsî-Bizans sınırı yüzyıllar boyunca düzenli savaş ve diplomasi döngüsüyle şekillendi. Esir değişimi (fidye) anlaşmaları, her iki tarafın da resmi olarak tanıdığı diplomatik bir kanal oluşturuyordu. Sınır garnizon sistemi hem askeri hem de kültürel bir etkileşim alanı yaratarak İslam-Hristiyan dünyaları arasında bilgi ve teknoloji akışına zemin hazırladı.","The Abbasid-Byzantine frontier was shaped by centuries of regular war and diplomacy cycles. Prisoner exchange (ransom) agreements created a diplomatic channel officially recognized by both sides. The frontier garrison system created both military and cultural interaction zones, facilitating knowledge and technology flow between Islamic and Christian worlds.","Sınır savunması Abbâsî askeri harcamalarının önemli kalemiydi; thughûr şehirleri stratejik öneme sahipti.","Esir değişimi diplomasisi uluslararası hukukun erken bir formu olarak İslam-Hristiyan ilişkilerini düzenledi."
"6","3","Karolenj İmparatorluğu","Carolingian Empire","İmparatorluk","Diplomasi","Diplomacy","797-809","Hârûnürreşîd-Charlemagne ittifakı; fil hediyesi","Harun-Charlemagne alliance; elephant gift","Hârûnürreşîd ile Charlemagne arasındaki diplomatik ilişki Ortaçağ'ın en ünlü devletlerarası diyaloglarından biridir. Abbâsî halifesinin Franklara gönderdiği fil (Ebu'l-Abbas) hediyesi, Hristiyan Avrupa'nın İslam dünyasıyla doğrudan diplomatik temasın sembolüdür. Her iki lider de ortak düşmanları olan Endülüs Emevîleri ve Bizans'a karşı stratejik yakınlaşma aradı.","The diplomacy between Harun al-Rashid and Charlemagne was one of the medieval period's most famous interstate dialogues. The elephant (Abu'l-Abbas) gifted by the Abbasid caliph to the Franks symbolized direct diplomatic contact between Christian Europe and the Islamic world. Both leaders sought strategic rapprochement against common enemies: the Umayyads of al-Andalus and Byzantium.","Ortak düşmanlara karşı stratejik ittifak arayışı her iki taraf için de siyasi avantaj sağladı.","Hârûn-Charlemagne ilişkisi İslam-Hristiyan diplomatik geleneğinin kurucu örneği olarak tarihe geçti."
"7","4","Kastilya Krallığı","Kingdom of Castile","Krallık","Savaş/Diplomasi","War/Diplomacy","756-1031","Reconquista savaşları; dönemsel barış","Reconquista wars; periodic peace","Endülüs Emevîleri ile Kastilya arasındaki asırlık çatışma (Reconquista), İber Yarımadası'nın siyasi haritasını belirleyen temel dinamikti. Savaş dönemleri arasında barış, ticaret ve kültürel alışveriş de yaşanıyordu. Müslüman, Hristiyan ve Yahudi topluluklarının birlikte yaşadığı 'convivencia' geleneği bu karmaşık ilişkinin kültürel ürünüydü.","The centuries-long conflict between the Umayyads of al-Andalus and Castile (Reconquista) was the fundamental dynamic shaping the Iberian Peninsula's political map. Between war periods, peace, trade and cultural exchange also occurred. The 'convivencia' tradition of Muslim, Christian and Jewish coexistence was the cultural product of this complex relationship.","Reconquista İber Yarımadası'ndaki güç dengesini kademeli olarak Hristiyanlar lehine değiştirdi.","Convivencia geleneği Avrupa'nın en verimli kültürlerarası diyalog deneyimlerinden biri; Toledo tercüme hareketi bu ortamın ürünü."
"8","27","Bizans İmparatorluğu","Byzantine Empire","İmparatorluk","Diplomasi/Ticaret","Diplomacy/Trade","969-1171","Sicilya ve Kuzey Afrika meseleleri; ticaret anlaşmaları","Sicily and North Africa issues; trade agreements","Fâtımîler Bizans ile pragmatik bir ilişki sürdürdü — Akdeniz ticaretinin devamlılığı her iki tarafın da çıkarınaydı. Sicilya ve Kuzey Afrika'daki çıkar çatışmalarına rağmen ticaret anlaşmaları diplomatik kanalları açık tuttu.","The Fatimids maintained a pragmatic relationship with Byzantium — continuation of Mediterranean trade served both sides' interests. Despite conflicts of interest in Sicily and North Africa, trade agreements kept diplomatic channels open.","Akdeniz ticaretinin sürdürülmesi her iki devlet için stratejik önceliktı.","Pragmatik ticaret diplomasisi ideolojik farklılıkları aşan İslam-Bizans ilişki modelini gösterir."
"9","27","Haçlı Devletleri","Crusader States","Krallık","Savaş","War","1099-1171","Kudüs Haçlı Krallığı ile sürekli savaş","Continuous war with Crusader Kingdom of Jerusalem","Fâtımî-Haçlı çatışması İslam dünyasının 11. yüzyıl sonundaki siyasi parçalanmasının doğrudan sonucudur. Fâtımîlerin zayıflığı Haçlıların Kudüs'ü almasını kolaylaştırdı. İslam dünyasındaki Sünnî-Şiî bölünmüşlüğü ortak düşmana karşı birleşmeyi engelledi.","The Fatimid-Crusader conflict was a direct result of the Islamic world's political fragmentation at the end of the 11th century. Fatimid weakness facilitated the Crusader capture of Jerusalem. The Sunni-Shia division in the Islamic world prevented unity against the common enemy.","Kudüs'ün kaybı İslam dünyasında birleşme çağrısını tetikledi; Zengîler ve Eyyûbîler bu çağrıya yanıt verdi.","Haçlı şoku İslam siyasi düşüncesinde 'cihat' kavramının yeniden canlanmasını sağladı."
"10","28","Haçlı Devletleri","Crusader States","Krallık","Savaş/Diplomasi","War/Diplomacy","1171-1260","Salâhaddîn'in Kudüs'ü geri alması; Richard ile müzakere","Saladin's reconquest of Jerusalem; negotiation with Richard","Salâhaddîn'in Haçlılara karşı kampanyası İslam tarihinin en saygın askeri-diplomatik başarılarından biridir. Hıttîn zaferi ve Kudüs'ün barışçıl geri alınması, ardından İngiltere Kralı Richard ile yapılan müzakereler Salâhaddîn'i hem İslam hem Batı dünyasında efsanevi bir figüre dönüştürdü.","Saladin's campaign against the Crusaders was one of the most respected military-diplomatic achievements in Islamic history. The Hattin victory, peaceful reconquest of Jerusalem, and negotiations with King Richard of England made Saladin a legendary figure in both Islamic and Western worlds.","Kudüs'ün geri alınması İslam dünyasının siyasi birleşme kapasitesini kanıtladı.","Salâhaddîn'in şövalye ruhu hem İslam hem Batı kültüründe ideal hükümdar modelini şekillendirdi."
"11","30","Moğol İlhanlıları","Mongol Ilkhanate","İmparatorluk","Savaş","War","1260-1323","Ayn Câlût zaferi; Suriye sınır savaşları","Ain Jalut victory; Syrian border wars","Memlûk-İlhanlı çatışması 13. yüzyılın en belirleyici jeopolitik rekabetiydi. Ayn Câlût (1260) zaferi Moğol yayılmasını durdurarak İslam dünyasının Mısır-Suriye eksenini korudu. Ardından gelen onlarca yıllık sınır savaşları Suriye'yi harap etti ancak Memlûk hâkimiyetini pekiştirdi.","The Mamluk-Ilkhanid conflict was the most defining geopolitical rivalry of the 13th century. The Ain Jalut (1260) victory stopped Mongol expansion, preserving the Egypt-Syria axis. Decades of border wars devastated Syria but consolidated Mamluk dominance.","Moğol yayılmasının durdurulması Mısır ve Suriye'nin İslam dünyası olarak kalmasını güvence altına aldı.","Memlûkler 'İslam'ın koruyucusu' kimliğini bu zaferle kazandı; hilafeti himayelerine aldılar."
"12","30","Haçlı Devletleri","Crusader States","Krallık","Savaş","War","1250-1291","Akka'nın fethi (1291) ile Haçlı varlığının sonu","Fall of Acre (1291) ending Crusader presence","Memlûklerin 1291'de Akka'yı alması iki yüz yıllık Haçlı varlığını sona erdirdi. Kalan Haçlı kaleleri birer birer düşürülerek Levant'tan Hristiyan askeri varlığı tamamen temizlendi. Bu son zafer Memlûklerin İslam dünyasındaki prestijini zirveye taşıdı.","The Mamluk capture of Acre in 1291 ended two centuries of Crusader presence. Remaining Crusader fortresses were taken one by one, completely eliminating Christian military presence from the Levant. This final victory elevated Mamluk prestige in the Islamic world to its peak.","Haçlı devletlerinin ortadan kalkması Doğu Akdeniz'in kalıcı olarak İslam kontrolüne geçmesini sağladı.","'Haçlı meselesi'nin çözümü Memlûkleri İslam dünyasının tartışılmaz askeri gücü olarak tescilledi."
"13","91","Bizans İmparatorluğu","Byzantine Empire","İmparatorluk","Savaş","War","1048-1092","Malazgirt (1071); Anadolu kapılarının açılması","Manzikert (1071); opening of Anatolia","Selçuklu-Bizans çatışmasının doruk noktası 1071 Malazgirt Savaşı, İslam ve Türk tarihinin en belirleyici anlarından biridir. Bizans İmparatoru Romanos Diogenes'in esir alınması benzeri görülmemiş bir prestij zaferiydi. Bu savaş Anadolu kapılarını Türk göçüne açarak bugünkü Türkiye'nin demografik temellerini attı.","The Seljuq-Byzantine conflict's climax at the 1071 Battle of Manzikert was one of the most decisive moments in Islamic and Turkish history. The capture of Byzantine Emperor Romanos Diogenes was an unprecedented prestige victory. This battle opened Anatolia's gates to Turkish migration, laying the demographic foundations of modern Turkey.","Anadolu'nun Türk-İslam dünyasına açılması Bizans'ı kalıcı olarak zayıflattı.","Malazgirt, Türk millî kimliğinin kurucu anlatısında merkezi yer tutar."
"14","94","Bizans İmparatorluğu","Byzantine Empire","İmparatorluk","Savaş/Diplomasi","War/Diplomacy","1077-1243","I. ve II. Haçlı Seferleri; Myriokephalon; sınır anlaşmaları","First and Second Crusades; Myriokephalon; border treaties","Anadolu Selçukluları-Bizans ilişkisi, Haçlı Seferleri'nin gölgesinde savaş ve pragmatik diplomasi arasında salınıyordu. I. ve II. Haçlı Seferleri'nde Selçuklular hem Haçlılarla hem Bizans'la çatıştı. 1176 Myriokephalon Savaşı Bizans'ın Anadolu'yu geri alma umutlarını kesin olarak sona erdirdi.","The Anatolian Seljuq-Byzantine relationship oscillated between war and pragmatic diplomacy under the shadow of the Crusades. Seljuqs clashed with both Crusaders and Byzantium during the Crusades. The 1176 Battle of Myriokephalon definitively ended Byzantine hopes of recovering Anatolia.","Myriokephalon zaferi Türk Anadolu'sunun kalıcılığını kesinleştirdi.","Selçuklu-Bizans sınır ilişkisi Anadolu'nun kültürel kimliğini şekillendirdi."
"15","99","Papalık","Papacy","Dini Otorite","Diplomasi","Diplomacy","1245-1335","Moğol-Papalık ittifak girişimleri; Haçlı koordinasyonu","Mongol-Papal alliance attempts; Crusade coordination","Moğol İlhanlıları Papalık ile Haçlılara karşı ortak ittifak arayışına girdi — İslam'a karşı Hristiyan-Moğol koalisyonu kurma girişimi. Diplomatik mektuplaşmalar ve elçi teatisi yapıldıysa da somut bir askeri ittifak gerçekleşmedi. Bu ilişki Ortaçağ diplomasisinin karmaşık çok taraflı yapısını gösterir.","The Mongol Ilkhanids sought alliance with the Papacy against the Crusades — an attempt to form a Christian-Mongol coalition against Islam. Diplomatic correspondence and envoy exchanges occurred but no concrete military alliance materialized. This relationship demonstrates medieval diplomacy's complex multilateral nature.","Moğol-Papalık ittifakının gerçekleşmemesi Memlûklerin hayatta kalmasını kolaylaştırdı.","Bu başarısız ittifak girişimi Avrasya diplomasisinin çok kutuplu yapısını belgeler."
"16","99","Yuan Çin Hanedanı","Yuan Dynasty China","İmparatorluk","Diplomasi/Ticaret","Diplomacy/Trade","1260-1335","Moğol birliği; İpek Yolu ticaretinin altın çağı","Mongol unity; golden age of Silk Road trade","İlhanlılar ve Yuan Çin'i arasındaki ilişki 'Pax Mongolica'nın en verimli boyutuydu. Moğol imparatorluğunun Pekin'den Tebriz'e uzanan birliği İpek Yolu ticaretinin altın çağını yaşattı. Marco Polo bu dönemin en ünlü seyyahıdır. Ticaretin yanı sıra astronomi, tıp ve mimari bilgi transferi de gerçekleşti.","The relationship between the Ilkhanids and Yuan China was the most productive dimension of the 'Pax Mongolica.' The Mongol Empire's unity from Beijing to Tabriz created the golden age of Silk Road trade. Marco Polo is the era's most famous traveler. Beyond trade, transfers of astronomical, medical and architectural knowledge occurred.","İpek Yolu trafiği tarihinin en yoğun dönemine ulaştı; Tebriz dünyanın en büyük ticaret merkezlerinden biri oldu.","Doğu-Batı bilgi transferi; Çin astronomisi İslam dünyasına, İslam tıbbı Çin'e ulaştı."
"17","124","Bizans İmparatorluğu","Byzantine Empire","İmparatorluk","Savaş/Fetih","War/Conquest","1299-1453","Anadolu ve Balkan fetihleri; İstanbul'un fethi (1453)","Anatolian and Balkan conquests; Fall of Constantinople","Osmanlı-Bizans ilişkisi, küçük bir sınır beyliğinin bir dünya imparatorluğunu yutmasının hikâyesidir. Osmanlılar stratejik evlilikler, diplomasi ve kademeli fetihlerle Bizans'ı yavaş yavaş kuşattı. 1453'te İstanbul'un fethi bin yıllık Doğu Roma'nın sonunu getirerek Osmanlı'yı İslam dünyasının lider gücüne dönüştürdü.","The Ottoman-Byzantine relationship is the story of a small frontier principality swallowing a world empire. The Ottomans gradually encircled Byzantium through strategic marriages, diplomacy and incremental conquests. The 1453 conquest of Constantinople ended the thousand-year Eastern Roman Empire, transforming the Ottomans into the Islamic world's leading power.","İstanbul'un fethi Osmanlı'ya dünya ticaretinin kontrolünü ve İslam'ın liderliğini kazandırdı.","Osmanlılar Bizans idari geleneğini ve İstanbul'un kozmopolit mirasını devraldı."
"18","124","Habsburg İmparatorluğu","Habsburg Empire","İmparatorluk","Savaş/Diplomasi","War/Diplomacy","1526-1791","Viyana kuşatmaları; Macaristan; Karlofça Antlaşması","Sieges of Vienna; Hungary; Treaty of Karlowitz","Osmanlı-Habsburg rekabeti 16.-18. yüzyıl Avrupa siyasetinin ana ekseniydi. 1526 Mohács zaferiyle Macaristan'ı alan Osmanlılar Viyana kapılarına dayandı. 1683 II. Viyana Kuşatması'nın başarısızlığı Osmanlı'nın Avrupa'daki yayılma limitini belirledi. 1699 Karlofça Antlaşması ilk büyük Osmanlı toprak kaybını resmileştirdi.","The Ottoman-Habsburg rivalry was the main axis of 16th-18th century European politics. After the 1526 Mohacs victory annexing Hungary, the Ottomans reached Vienna's gates. The failure of the 1683 Second Siege of Vienna set the limit of Ottoman expansion in Europe. The 1699 Treaty of Karlowitz formalized the first major Ottoman territorial losses.","Viyana kuşatmalarının sonuçları Avrupa'nın siyasi haritasını kalıcı olarak şekillendirdi.","Karlofça Antlaşması Osmanlı'nın yayılmadan savunmaya geçişinin dönüm noktası."
"19","124","Venedik Cumhuriyeti","Republic of Venice","Şehir Devleti","Savaş/Ticaret","War/Trade","1416-1718","Deniz savaşları; Girit; Mora; ticaret imtiyazları (kapitülasyonlar)","Naval wars; Crete; Morea; trade capitulations","Osmanlı-Venedik ilişkisi savaş ve ticaretin iç içe geçtiği benzersiz bir dinamikti. Deniz savaşları ve fetihler (Girit, Mora) sürerken ticaret anlaşmaları (kapitülasyonlar) ekonomik bağları korudu. Venedik tüccarları İstanbul'da ayrıcalıklı bir konuma sahipti. Bu çelişkili ilişki Osmanlı'nın pragmatik dış politikasını yansıtır.","The Ottoman-Venetian relationship was a unique dynamic where war and trade intertwined. While naval wars and conquests (Crete, Morea) continued, trade agreements (capitulations) preserved economic ties. Venetian merchants held privileged status in Istanbul. This contradictory relationship reflects Ottoman pragmatic foreign policy.","Akdeniz'in kontrolü için deniz savaşları ve ticaret anlaşmaları eş zamanlı yürütüldü.","Kapitülasyon sistemi sonraki yüzyıllarda Osmanlı ekonomisinin yapısal sorunlarının kaynağı haline geldi."
"20","124","Fransa Krallığı","Kingdom of France","Krallık","İttifak/Diplomasi","Alliance/Diplomacy","1536-1798","Kanuni-I. François ittifakı; kapitülasyonlar; Napolyon Mısır seferi","Suleiman-Francis I alliance; capitulations; Napoleon's Egypt campaign","Kanuni-I. François ittifakı, İslam dünyası ile Hristiyan Avrupa arasındaki ilk resmi stratejik ittifaktır. Ortak düşman Habsburg'a karşı kurulan bu ittifak dinler arası siyasi pragmatizmin çarpıcı örneğidir. Kapitülasyon sistemiyle Fransız tüccarlara verilen ayrıcalıklar yüzyıllarca sürecek Osmanlı-Fransız ilişkilerinin temelini attı.","The Suleiman-Francis I alliance was the first formal strategic alliance between the Islamic world and Christian Europe. Built against the common Habsburg enemy, this alliance was a striking example of inter-religious political pragmatism. Privileges granted to French merchants through the capitulation system laid the foundation for centuries of Ottoman-French relations.","Habsburg'a karşı iki cephe açılması Avrupa güç dengesini değiştirdi.","Osmanlı-Fransız ittifakı uluslararası ilişkilerde 'dinin üstünde' stratejik pragmatizmin erken örneği."
"21","124","Rusya İmparatorluğu","Russian Empire","İmparatorluk","Savaş","War","1568-1918","13 Osmanlı-Rus savaşı; Kırım meselesi; Boğazlar","13 Ottoman-Russian wars; Crimean question; Straits","Osmanlı-Rus savaşları (1568-1918), İslam ile Hristiyan dünyası arasındaki en uzun soluklu ve en yıkıcı askeri çatışma serisidir. On üç büyük savaş, Kırım meselesi, Boğazlar sorunu ve 'Şark Meselesi' bu ilişkinin ana temaları oldu. Rusya'nın güneye inme politikası Osmanlı'nın en büyük stratejik tehdidiydi.","Ottoman-Russian wars (1568-1918) were the longest and most destructive military conflict series between the Islamic and Christian worlds. Thirteen major wars, the Crimean question, Straits issue and 'Eastern Question' were the main themes. Russia's southward expansion policy was the Ottomans' greatest strategic threat.","13 savaş Osmanlı'nın askeri ve ekonomik kaynaklarını tüketerek çöküş sürecini hızlandırdı.","Osmanlı-Rus rekabeti Karadeniz, Kafkasya ve Balkanlar'ın modern siyasi haritasını şekillendirdi."
"22","107","Portekiz Krallığı","Kingdom of Portugal","Krallık","Savaş/Ticaret","War/Trade","1507-1622","Hürmüz Boğazı kontrolü; Hint Okyanusu rekabeti","Control of Strait of Hormuz; Indian Ocean rivalry","Safevî-Portekiz çatışması Hint Okyanusu'nun kontrolü için verilen mücadelenin Basra Körfezi ayağıydı. Portekizliler 1507'de Hürmüz'ü alarak İran ticaretinin boğaz noktasını kontrol altına aldı. Şah Abbas 1622'de İngiliz yardımıyla Hürmüz'ü geri alarak bu tehdidi bertaraf etti.","The Safavid-Portuguese conflict was the Persian Gulf dimension of the struggle for Indian Ocean control. The Portuguese captured Hormuz in 1507, controlling the chokepoint of Iranian trade. Shah Abbas recaptured Hormuz in 1622 with English help, neutralizing this threat.","Hürmüz'ün kaybı ve geri alınması İran'ın deniz ticareti kontrolü açısından kritikti.","Safevî-İngiliz işbirliği Avrupa güçlerinin bölge içi rekabetleri kullanma stratejisinin erken örneği."
"23","107","Osmanlı İmparatorluğu","Ottoman Empire","İmparatorluk","Savaş/Diplomasi","War/Diplomacy","1514-1639","Çaldıran; Irak savaşları; Kasr-ı Şîrîn Antlaşması","Chaldiran; Iraq wars; Treaty of Zuhab","Osmanlı-Safevî rekabeti İslam dünyasının en derin mezhepsel bölünmesini yaratan stratejik çatışmadır. 1514 Çaldıran'dan 1639 Kasrı Şîrîn Antlaşması'na kadar süren savaşlar Sünnî-Şiî sınırını kalıcı olarak belirledi. Irak uzun süre iki güç arasında el değiştirdi. Bu rekabet bugünkü Ortadoğu'nun mezhepsel-siyasi haritasının temelini oluşturur.","The Ottoman-Safavid rivalry was the strategic conflict that created the Islamic world's deepest sectarian division. Wars from the 1514 Chaldiran to the 1639 Treaty of Zuhab permanently defined the Sunni-Shia boundary. Iraq long changed hands between the two powers. This rivalry forms the foundation of today's Middle East sectarian-political map.","Sünnî-Şiî sınırı askeri çatışmayla kalıcılaştı; Irak ve Kafkasya'nın kaderi bu rekabette belirlendi.","Çaldıran ve Kasrı Şîrîn'in çizdiği sınır bugünkü Türkiye-İran sınırının büyük bölümünü oluşturur."
