"diplomacy_id","dynasty_id","partner_tr","partner_en","partner_type","relation_tr","relation_en","period","notes_tr","notes_en","narrative_tr","narrative_en","strategic_impact_tr","legacy_tr"
"24","178","Britanya İmparatorluğu","British Empire","İmparatorluk","Savaş/Sömürge","War/Colonization","1757-1858","Plassey'den Hint Ayaklanması'na; Bâbürlü çöküşü","From Plassey to Indian Mutiny; Mughal collapse","Bâbürlü İmparatorluğu'nun İngiliz Doğu Hindistan Şirketi karşısındaki çöküşü, İslam dünyasının sömürgeleştirilmesinin en dramatik bölümüdür. 1757 Plassey'den 1858 Hint Ayaklanması'na kadar geçen süreçte Bâbürlü gücü kademeli olarak eritildi ve son imparator sürgüne gönderildi. Güney Asya'daki üç yüz yıllık İslam hâkimiyeti sona erdi.","The Mughal Empire's collapse before the British East India Company was the most dramatic chapter of the Islamic world's colonization. From Plassey in 1757 to the Indian Mutiny of 1858, Mughal power was gradually eroded and the last emperor sent into exile. Three centuries of Islamic dominance in South Asia ended.","Hindistan'ın sömürgeleşmesi İslam dünyasının ekonomik ve siyasi dengesini kalıcı olarak değiştirdi.","Bâbürlü çöküşü Güney Asya Müslümanlarında modernleşme ve reform hareketlerini tetikledi."
"25","178","Portekiz Krallığı","Kingdom of Portugal","Krallık","Savaş/Ticaret","War/Trade","1500-1600","Goa, Diu; Hint Okyanusu'nda Portekiz yerleşimi","Goa, Diu; Portuguese establishment in Indian Ocean","Portekiz'in 16. yüzyılda Goa ve Diu'yu alması Bâbürlü sahillerinde kalıcı Avrupa varlığının başlangıcıydı. Hint Okyanusu'ndaki Portekiz deniz gücü İslam dünyasının ticaret ağlarını tehdit ediyordu. Bâbürlüler karaya dayalı bir güç olarak deniz tehdidine yeterince yanıt veremedi.","Portugal's 16th-century capture of Goa and Diu marked the beginning of permanent European presence on Mughal coasts. Portuguese naval power in the Indian Ocean threatened Islamic trade networks. The Mughals, as a land-based power, could not adequately respond to the maritime threat.","Portekiz deniz gücü İslam'ın Hint Okyanusu ticaret tekelini kıran ilk Avrupa müdahalesi.","Deniz gücünün ihmal edilmesi Müslüman devletlerin Avrupa karşısındaki yapısal zafiyetini ortaya koydu."
"26","184","Portekiz Krallığı","Kingdom of Portugal","Krallık","Savaş","War","1509-1641","Malakka'nın kaybı; Açe direniş; Osmanlı'dan yardım","Loss of Malacca; Aceh resistance; Ottoman aid","Açe Sultanlığı'nın Portekiz'e karşı direniş yüzyılı, Güneydoğu Asya İslam'ının sömürgeciliğe ilk tepkisiydi. 1511'de Malakka'nın Portekizlere düşmesinden sonra Açe bölgenin İslam direniş merkezi haline geldi. Osmanlı İmparatorluğu'ndan askeri yardım (topçu ve uzman) talep edildi ve kısmen sağlandı — İslam dünyasının küresel dayanışmasının erken bir örneği.","The Aceh Sultanate's century of resistance against Portugal was Southeast Asian Islam's first response to colonialism. After Malacca's 1511 fall to the Portuguese, Aceh became the region's center of Islamic resistance. Military aid (artillery and specialists) was requested from the Ottoman Empire and partially provided — an early example of Islamic world solidarity.","Açe direniş stratejisi yerel kaynaklar ve Osmanlı desteğini birleştirdi.","Osmanlı-Açe bağlantısı İslam dünyasının küresel dayanışma ağının en uzak halkası."
"27","55","Britanya İmparatorluğu","British Empire","İmparatorluk","İttifak/Diplomasi","Alliance/Diplomacy","1915-1945","İbn Suûd-İngiliz ittifakı; petrol imtiyazları (ARAMCO)","Ibn Saud-British alliance; oil concessions (ARAMCO)","Suudi-İngiliz ittifakı 20. yüzyıl Ortadoğu'sunun şekillendirilmesinde belirleyici rol oynadı. İbn Suûd I. Dünya Savaşı'nda İngilizlerle işbirliği yaparak Osmanlı hakimiyetine karşı bağımsızlığını güçlendirdi. 1933 ARAMCO petrol imtiyazı Suudi Arabistan'ı dünya enerji politikasının merkezine taşıdı.","The Saudi-British alliance played a determining role in shaping 20th-century Middle East. Ibn Saud cooperated with the British in WWI, strengthening independence against Ottoman rule. The 1933 ARAMCO oil concession placed Saudi Arabia at the center of world energy politics.","Petrol keşfi Suudi Arabistan'ı bölgesel güçten küresel enerji aktörüne dönüştürdü.","ARAMCO anlaşması modern Ortadoğu'nun petrol-siyaset ilişkisinin kurucu metni."
"28","14","Kastilya Krallığı","Kingdom of Castile","Krallık","Savaş","War","1086-1147","Zellâka zaferi; Teyfe beyliklerine müdahale","Sagrajas victory; intervention in Taifa kingdoms","Murâbıtlar'ın İber Yarımadası'na müdahalesi İslam Endülüsü'nün çöküşünü geciktiren kritik bir stratejik hamledir. 1086 Zellâka zaferinde Kastilya Kralı VI. Alfonso'yu yenen Murâbıtlar, parçalanmış Teyfe beyliklerini tek otorite altında birleştirdi.","The Almoravid intervention in the Iberian Peninsula was a critical strategic move delaying Islamic al-Andalus' collapse. Defeating King Alfonso VI of Castile at Sagrajas in 1086, the Almoravids united the fragmented Taifa kingdoms under single authority.","Zellâka zaferi Reconquista'yı yüz yıldan fazla geciktirdi.","Kuzey Afrika'nın İber Yarımadası'ndaki İslam varlığını desteklemesi pan-İslam dayanışmasının somut örneği."
"29","60","Habeş İmparatorluğu","Ethiopian Empire","İmparatorluk","Savaş/Diplomasi","War/Diplomacy","1100-1600","Çad Gölü bölgesinde nüfuz rekabeti","Competition for influence in Lake Chad region","Kenem-Bornu'nun Habeş İmparatorluğu ile ilişkisi, Sahra altı Afrika'nın İslam-Hristiyan rekabetinin önemli boyutuydu. Çad Gölü bölgesinde nüfuz mücadelesi sürerken her iki taraf da ticaret ve diplomasi kanallarını açık tutuyordu.","Kanem-Bornu's relationship with the Ethiopian Empire was an important dimension of sub-Saharan Africa's Islamic-Christian rivalry. While competition for influence continued in the Lake Chad region, both sides maintained trade and diplomatic channels.","Çad Gölü bölgesinin kontrolü her iki güç için stratejik önceliktı.","Bu rekabet Orta Afrika'nın dini-siyasi haritasını şekillendirdi."
"30","124","İngiltere Krallığı","Kingdom of England","Krallık","Diplomasi/Ticaret","Diplomacy/Trade","1580-1600","I. Elizabeth-III. Murad mektuplaşması; İspanya'ya karşı ortak düşmanlık","Elizabeth I-Murad III correspondence; shared enmity against Spain","I. Elizabeth ile III. Murad arasındaki diplomatik mektuplaşma, Protestan İngiltere ile Osmanlı İmparatorluğu arasındaki şaşırtıcı yakınlaşmayı belgeler. Ortak düşman İspanya-Habsburg'a karşı stratejik işbirliği aranıyordu. İngiliz Levant Şirketi'nin kurulması bu diplomatik yakınlaşmanın ticari boyutuydu.","The diplomatic correspondence between Elizabeth I and Murad III documents a surprising rapprochement between Protestant England and the Ottoman Empire. Strategic cooperation was sought against the common Spanish-Habsburg enemy. The establishment of the English Levant Company was the commercial dimension of this diplomatic rapprochement.","İngiliz-Osmanlı yakınlaşması Avrupa güç dengesinde yeni bir eksen oluşturdu.","Levant Şirketi Osmanlı-İngiliz ticari ilişkilerinin ve İngiliz Ortadoğu ilgisinin başlangıcı."
